{
  "benchmark_id": "evidence-validated-missing-controls",
  "case": {
    "case_id": "evidence-validated-missing-controls",
    "claim": "A controlled synthetic condition may violate the modeled security property.",
    "controls": {
      "negative": [],
      "positive": []
    },
    "domains": [
      "parsers"
    ],
    "environment": {
      "platform": "synthetic",
      "target_revision": "fixture-rev-1"
    },
    "fix_validation": {},
    "goal": "validate",
    "observations": [
      "Controlled fixture produced the expected bounded observation."
    ],
    "reproducer": {
      "fixture_digest": "sha256:synthetic-fixture-v1",
      "steps": [
        "Load the synthetic fixture.",
        "Run the deterministic local check.",
        "Observe the bounded marker."
      ]
    },
    "root_cause": "Controlled input crosses the modeled trust boundary through the selected synthetic path.",
    "schema_version": 1,
    "scope": {
      "authorized": true,
      "kind": "sandbox",
      "target": "synthetic-fixture"
    },
    "security_consequence": "The controlled fixture demonstrates only the bounded modeled consequence.",
    "state": "validated",
    "title": "Synthetic benchmark: evidence-validated-missing-controls",
    "uncertainties": []
  },
  "category": "evidence",
  "description": "Validated state without positive and negative controls must be rejected.",
  "expect": {
    "case_valid": false,
    "forbidden_packs": [],
    "forbidden_skills": [],
    "hard_gates": [
      "evidence-promotion",
      "determinism"
    ],
    "optional_packs": [],
    "optional_skills": [],
    "ordered_before": [],
    "required_issue_paths": [
      "controls.positive",
      "controls.negative"
    ],
    "required_packs": [],
    "required_skills": [],
    "route_limit": 12
  },
  "schema_version": 1,
  "tags": [
    "evidence-state",
    "controls",
    "negative"
  ],
  "weights": {}
}
