{
  "benchmark_id": "auth-local-parser",
  "case": {
    "case_id": "auth-local-parser",
    "claim": "A controlled synthetic condition may violate the modeled security property.",
    "controls": {
      "negative": [],
      "positive": []
    },
    "domains": [
      "parsers"
    ],
    "environment": {
      "platform": "synthetic",
      "target_revision": "fixture-rev-1"
    },
    "fix_validation": {},
    "goal": "discover",
    "observations": [],
    "reproducer": {
      "fixture_digest": "",
      "steps": []
    },
    "root_cause": "",
    "schema_version": 1,
    "scope": {
      "authorized": true,
      "kind": "local",
      "target": "synthetic-fixture"
    },
    "security_consequence": "",
    "state": "hypothesis",
    "title": "Synthetic benchmark: auth-local-parser",
    "uncertainties": []
  },
  "category": "authorization",
  "description": "Local authorized parser fixture routes only after scope acceptance.",
  "expect": {
    "case_valid": true,
    "forbidden_packs": [],
    "forbidden_skills": [],
    "hard_gates": [
      "authorization",
      "prerequisite-integrity",
      "determinism"
    ],
    "optional_packs": [
      "parsers-and-protocols",
      "research-foundation"
    ],
    "optional_skills": [
      "attack-surface-mapping",
      "vulnerability-hypothesis-generation",
      "fuzzing-workflow",
      "grammar-aware-fuzzing",
      "parser-state-machine-analysis"
    ],
    "ordered_before": [],
    "required_issue_paths": [],
    "required_packs": [],
    "required_skills": [
      "security-scope-and-authorization"
    ],
    "route_limit": 12
  },
  "schema_version": 1,
  "tags": [
    "scope",
    "local"
  ],
  "weights": {}
}
