{
  "benchmark_id": "domain-ios-excludes-android",
  "case": {
    "case_id": "domain-ios-excludes-android",
    "claim": "A controlled synthetic condition may violate the modeled security property.",
    "controls": {
      "negative": [],
      "positive": []
    },
    "domains": [
      "mobile",
      "ios"
    ],
    "environment": {
      "platform": "synthetic",
      "target_revision": "fixture-rev-1"
    },
    "fix_validation": {},
    "goal": "root-cause",
    "observations": [],
    "reproducer": {
      "fixture_digest": "",
      "steps": []
    },
    "root_cause": "",
    "schema_version": 1,
    "scope": {
      "authorized": true,
      "kind": "sandbox",
      "target": "synthetic-fixture"
    },
    "security_consequence": "",
    "state": "hypothesis",
    "title": "Synthetic benchmark: domain-ios-excludes-android",
    "uncertainties": []
  },
  "category": "domain-isolation",
  "description": "iOS routing must not leak Android-exclusive capabilities.",
  "expect": {
    "case_valid": true,
    "forbidden_packs": [],
    "forbidden_skills": [
      "android-component-exposure-analysis",
      "android-intent-and-deeplink-analysis",
      "android-webview-bridge-analysis"
    ],
    "hard_gates": [
      "domain-isolation",
      "prerequisite-integrity",
      "determinism"
    ],
    "optional_packs": [
      "program-analysis"
    ],
    "optional_skills": [
      "security-scope-and-authorization",
      "attack-surface-mapping",
      "vulnerability-hypothesis-generation",
      "ios-url-scheme-and-universal-link-analysis",
      "mobile-network-trust-analysis",
      "static-dataflow-analysis"
    ],
    "ordered_before": [],
    "required_issue_paths": [],
    "required_packs": [
      "mobile-security"
    ],
    "required_skills": [
      "ios-entitlement-and-sandbox-analysis"
    ],
    "route_limit": 12
  },
  "schema_version": 1,
  "tags": [
    "ios",
    "exclusive"
  ],
  "weights": {}
}
