{
  "benchmark_id": "evidence-observed-valid",
  "case": {
    "case_id": "evidence-observed-valid",
    "claim": "A controlled synthetic condition may violate the modeled security property.",
    "controls": {
      "negative": [],
      "positive": []
    },
    "domains": [
      "parsers"
    ],
    "environment": {
      "platform": "synthetic",
      "target_revision": "fixture-rev-1"
    },
    "fix_validation": {},
    "goal": "validate",
    "observations": [
      "Controlled fixture produced the expected bounded observation."
    ],
    "reproducer": {
      "fixture_digest": "",
      "steps": []
    },
    "root_cause": "",
    "schema_version": 1,
    "scope": {
      "authorized": true,
      "kind": "sandbox",
      "target": "synthetic-fixture"
    },
    "security_consequence": "",
    "state": "observed",
    "title": "Synthetic benchmark: evidence-observed-valid",
    "uncertainties": []
  },
  "category": "evidence",
  "description": "observed research-case evidence satisfies its declared state contract.",
  "expect": {
    "case_valid": true,
    "forbidden_packs": [],
    "forbidden_skills": [],
    "hard_gates": [
      "evidence-promotion",
      "prerequisite-integrity",
      "determinism"
    ],
    "optional_packs": [
      "parsers-and-protocols",
      "verification-engineering"
    ],
    "optional_skills": [
      "security-scope-and-authorization",
      "attack-surface-mapping",
      "fuzzing-workflow",
      "grammar-aware-fuzzing",
      "parser-state-machine-analysis"
    ],
    "ordered_before": [],
    "required_issue_paths": [],
    "required_packs": [],
    "required_skills": [
      "evidence-driven-vulnerability-validation"
    ],
    "route_limit": 12
  },
  "schema_version": 1,
  "tags": [
    "evidence-state",
    "observed"
  ],
  "weights": {}
}
